id,title,url,license,accessed,sha256,vendored,fetch,notes
ghsl_built_s_r2023a,"GHS-BUILT-S R2023A: накопленная застроенная поверхность, 100 м, Молльвейде, эпохи 1975-2020 (40 тайлов R3/R4 x C20/C21)",https://human-settlement.emergency.copernicus.eu/ghs_buS2023.php,"CC BY 4.0 (Pesaresi M., Politis P. (2023), European Commission JRC)",2026-07-16,,"sources/raw/registry_ghsl.csv (пер-тайловые URL+sha256); производные агрегаты sources/raw/morph_*.csv","python3 code/fetch.py --ghsl","глобальные тайлы ~0,8 ГБ не вендорятся; эпохи 2025/2030 продукта - модельные, не используются; DOI 10.2905/9F06F36F-4B11-47EC-ABB0-4F8B7B1D72EA"
geofabrik_belarus_pbf,"Geofabrik OSM extract: Belarus (belarus-latest.osm.pbf, выгрузка 2026-07-15T20:21:10Z)",https://download.geofabrik.de/europe/belarus-latest.osm.pbf,"ODbL 1.0 (© OpenStreetMap contributors)",2026-07-16,048d0ccfb8847ac584b45b2eed96cf8f13a117bdd671dccda4bb2b93248080cc,"sources/raw/registry_osm.csv; производные sources/raw/city_roads.csv|city_poi.csv|city_buildings.csv|admin_areas.csv|admin_built.csv","python3 code/fetch.py --osm","~346 МБ не вендорится; md5 cd2d35c0beb372c835b51396fe0759f3 сверен с официальным .md5; история правок OSM НЕ используется для датировки строительства"
bymaps_population,"Ряды населения городов Беларуси 1897-2026 (переписи 'c' и оценки 'e'; компиляция pop-stat.mashke.org по официальным публикациям Белстата, обработка BY Maps)",https://pop-stat.mashke.org/belarus-cities.htm,"использование с указанием источника",2026-07-16,,"sources/raw/city_population.csv (экстракт 94 городов)","см. пакет by-maps-zipf (fetch.py первоисточника)","полные ряды и провенанс - в основном датасете BY Maps (web/public/data/data.json)"
inf08_nightlights_clips,"Вырезки ночной светимости Беларуси: calDMSP 1992-2013 (Li et al.) и VIIRS VNL v2.1 2012-2024 (EOG), факелы двух НПЗ обнулены",https://by-population-maps.vercel.app/artifacts/nightlights,"CC BY 4.0 (Li et al., Figshare 9828827 v10); VNL - Earth Observation Group, Colorado School of Mines",2026-07-16,,"sources/raw/city_light.csv (зональные суммы по маскам городов)","пакет by-maps-nightlights-v2.1.1 (registry_v2.csv: URL+sha256 всех 35 растров)","методика гармонизации и дефакеляции - в пакете INF-08 v2"
inf06_monotowns,"Реестр моногородов и градообразующих предприятий (INF-06, ручная курация с построчными источниками)",https://by-population-maps.vercel.app/artifacts/monotowns,"CC BY 4.0 (BY Maps)",2026-07-16,,sources/raw/monotowns.csv,"пакет by-maps-monotowns-v1.0.0","используется только колонка mono_dependence для выбора кейса"
